commit	val_sharpe	sortino	sharpe_ann_4h	calmar	psr	dsr	skew	kurtosis	max_drawdown	win_rate	total_trades	train_sharpe	train_calmar	train_max_drawdown	train_total_trades	val_sub_min	val_sub_std	val_sub_neg_count	status	timestamp	description
8171ab8	2.355820	6.330539	2.628073	11.707747	0.999930	0.999930	2.147	53.439	1.18	0.654	26	0.680261	1.517979	4.96	43	0.043067	0.014846	0	keep	2026-05-27 18:55	Remove volume confirmation filter to reduce entry condition stack and increase trade count (simpler signal, fewer constraints when no prior trades recorded).
1567b1c	2.018337	4.724731	2.231888	6.992631	0.999316	0.999316	1.817	46.518	1.75	0.613	31	0.793921	1.819042	4.96	44	0.008558	0.029420	0	discard	2026-05-27 18:56	Relax ADX threshold from 25 to 20 to allow more entry opportunities while retaining momentum filter (widen entry set for improved trade frequency without removing filter entirely).
7617c4d	0.000000	0.000000	0.000000	0.000000	0.000000	0.000000	0.000	0.000	0.00	0.000	0	0.000000	0.000000	0.00	0	0.000000	0.000000	0	crash	2026-05-27 18:57	Remove vol_regime_high entry filter (ATR > ATR_MA) — ADX+DI already confirm trend strength/direction; this redundant volatility-expansion condition cuts trade count too close to the 20-trade floor, ri
c7a640f	1.936330	4.134164	2.135189	5.320278	0.998607	0.996137	0.737	36.915	2.55	0.476	42	0.565827	1.192938	6.54	67	0.031212	0.011906	0	discard	2026-05-27 18:58	Fix crash: re-add missing `atr_ma_period` attribute removed by prior commit; required by init() for trailing stop regime logic.
5f2d018	2.231412	5.929214	2.442689	9.081832	0.999789	0.998927	2.144	58.738	1.36	0.593	27	0.652892	2.010740	3.24	43	0.047767	0.005831	0	discard	2026-05-27 18:59	Re-add Donchian short-exit rail at 10-bar period to catch slow trend reversals (Turtle rule: entry 24, exit 10) while keeping ATR trailing stop for flash crashes.
